number,value,datetime_start,datetime_complete,duration,params_aggregation,params_batch_norm,params_depth,params_dropout,params_ffn_hidden_dim,params_ffn_num_layers,params_final_lr_ratio,params_init_lr_ratio,params_max_lr,params_message_hidden_dim,params_warmup_epochs,user_attrs_test_mae,user_attrs_test_r2,user_attrs_test_rmse,user_attrs_test_samples,state
77,0.2955826222896576,2026-05-08 03:21:45.736566,2026-05-08 03:33:40.310580,0 days 00:11:54.574014,mean,False,5,0.24205334844630322,1768,6,0.8190595053515398,0.3163976795243876,0.003327501529139845,476,3,7.849772401037193,0.6819254133711659,11.586604224810715,6185,COMPLETE
78,0.2847217619419098,2026-05-08 03:33:40.311060,2026-05-08 03:48:38.741521,0 days 00:14:58.430461,mean,False,6,0.21763365189207579,2933,5,0.10442593812200082,0.08623114076822302,0.0015483841948915778,353,2,7.594685404476082,0.6942611701409155,11.359703249525433,6185,COMPLETE
79,0.21521532535552979,2026-05-08 03:48:38.741934,2026-05-08 04:08:35.006364,0 days 00:19:56.264430,mean,False,3,0.27054124441183736,1345,5,0.4483754414975389,0.2403446070957293,0.002393448845379523,408,1,7.646085539611964,0.7717707853487764,9.814706225203192,6185,COMPLETE
80,0.3859381377696991,2026-05-08 04:08:35.006763,2026-05-08 04:23:34.180185,0 days 00:14:59.173422,mean,False,3,0.3055475234239226,1137,4,0.6109653367494288,0.23360451265680773,0.0024320943292450246,449,3,10.746990019444409,0.5799118169938644,13.315636146135871,6185,COMPLETE
81,0.38409265875816345,2026-05-08 04:23:34.180571,2026-05-08 04:37:33.522130,0 days 00:13:59.341559,mean,False,3,0.27009778834794856,1440,4,0.43840938199656826,0.2779537431490604,0.002675599018532807,510,1,10.41402336743539,0.601808798940558,12.963955046231064,6185,COMPLETE
82,0.263523131608963,2026-05-08 04:37:33.522481,2026-05-08 05:02:31.907783,0 days 00:24:58.385302,mean,False,2,0.283391412222612,271,5,0.2895169984533176,0.1556305000558127,0.002219029164157113,404,1,8.710718406239343,0.7106733481589775,11.050601235036691,6185,COMPLETE
83,0.23511265218257904,2026-05-08 05:02:31.908255,2026-05-08 05:25:32.498487,0 days 00:23:00.590232,mean,False,2,0.2898160955508914,591,5,0.21488654438331073,0.19387998980533028,0.002228560457845251,395,1,7.492861050333626,0.7474726980969325,10.323949135244593,6185,COMPLETE
84,0.29931795597076416,2026-05-08 05:25:32.498885,2026-05-08 05:50:31.573243,0 days 00:24:59.074358,mean,False,2,0.3285731886352947,371,4,0.17276632551020749,0.1962079305675143,0.001791089793948495,552,1,8.276143617252236,0.6696448241155073,11.808160420421014,6185,COMPLETE
85,2.9695801734924316,2026-05-08 05:50:31.573687,2026-05-08 05:59:35.223033,0 days 00:09:03.649346,norm,False,2,0.2749618762069333,584,5,0.21517962291156617,0.24443796719600683,0.0022357467748195642,454,2,34.95948980974399,-2.1445799990144065,36.431160921106915,6185,COMPLETE
86,0.3116533160209656,2026-05-08 05:59:35.223498,2026-05-08 06:04:27.957781,0 days 00:04:52.734283,mean,False,2,0.24985533993218054,1315,4,0.5122631732802978,0.16872078069070132,0.002078370719225508,412,1,9.039894968709737,0.6570654878784543,12.030876916599876,6185,COMPLETE
87,0.2099095582962036,2026-05-08 06:04:27.958354,2026-05-08 06:12:06.462471,0 days 00:07:38.504117,mean,False,3,0.30876677282238657,458,5,0.3483646093316539,0.7437123840237139,0.002433057739988784,380,1,6.637759211917221,0.7847114479613251,9.532397745885273,6185,COMPLETE
88,0.26505693793296814,2026-05-08 06:12:06.462869,2026-05-08 06:17:15.662028,0 days 00:05:09.199159,mean,False,3,0.32625911504008903,348,5,0.3419261014957236,0.8164962820147369,0.002433214702038119,954,1,7.213668159602049,0.7255504664951054,10.762742140244127,6185,COMPLETE
89,0.5599668025970459,2026-05-08 06:17:15.664074,2026-05-08 06:19:31.594200,0 days 00:02:15.930126,mean,True,2,0.30629670814273147,652,5,0.40940801479163547,0.8965783358536644,0.0026316748058865676,386,1,10.82169996182959,0.3961182539042205,15.96495276443554,6185,COMPLETE
90,3.5557548999786377,2026-05-08 06:19:31.594592,2026-05-08 06:24:03.363776,0 days 00:04:31.769184,sum,False,3,0.3530815930234586,479,5,0.4808452384537538,0.7271194180523034,0.0028888816624139313,1210,1,38.60945793774789,-2.7852744584579394,39.970572988373235,6185,COMPLETE
91,0.17695610225200653,2026-05-08 06:24:03.364235,2026-05-08 06:28:40.938095,0 days 00:04:37.573860,mean,False,4,0.29124401003232997,464,6,0.2400617103458299,0.21874797161741355,0.0019487044907089386,374,1,6.394109367302761,0.8124015025249949,8.898286090226849,6185,COMPLETE
92,0.24588076770305634,2026-05-08 06:28:40.938621,2026-05-08 06:35:31.732779,0 days 00:06:50.794158,mean,False,4,0.29383246819647973,438,6,0.2374186514232209,0.21389942668109932,0.001915536517825783,364,1,7.166223184004269,0.7468335811060427,10.337005231962838,6185,COMPLETE
93,0.2571502923965454,2026-05-08 06:35:31.733194,2026-05-08 06:43:19.674950,0 days 00:07:47.941756,mean,False,4,0.312809738609855,431,5,0.18669824266006896,0.7745683666126467,0.002037683008702072,1089,1,7.274760724424641,0.724080096758993,10.79153444811505,6185,COMPLETE
94,0.1945534348487854,2026-05-08 06:43:19.675311,2026-05-08 06:59:21.561216,0 days 00:16:01.885905,mean,False,3,0.34016509386186333,508,6,0.24409881941209274,0.223689906695547,0.0022248673994815387,345,1,6.427272974876213,0.7911254581899126,9.38932651533567,6185,COMPLETE
95,0.2271353155374527,2026-05-08 06:59:21.561540,2026-05-08 07:16:28.739693,0 days 00:17:07.178153,mean,False,3,0.3718657061907483,318,6,0.36426652660691805,0.2562336703060062,0.00238468459800835,346,1,6.682384977595114,0.7652391597948895,9.9541576456582,6185,COMPLETE
96,0.20258168876171112,2026-05-08 07:16:28.740027,2026-05-08 07:35:33.626601,0 days 00:19:04.886574,mean,False,3,0.33775844680978134,537,6,0.7303072402828988,0.22830076347476622,0.002746580125090067,332,1,7.095263124186856,0.782037063521165,9.591422279297342,6185,COMPLETE
97,0.283812940120697,2026-05-08 07:35:33.627028,2026-05-08 07:47:19.045119,0 days 00:11:45.418091,mean,False,3,0.35319927596756934,522,6,0.7780279399209239,0.2144859935297113,0.002778514864270712,374,2,7.47607615292795,0.7028073196833886,11.19981222182914,6185,COMPLETE
98,0.18511678278446198,2026-05-08 07:47:19.045467,2026-05-08 08:02:54.954961,0 days 00:15:35.909494,mean,False,3,0.3407451162882973,431,6,0.14073060142651106,0.2908693390313515,0.0025773211988252423,294,1,6.903737914841697,0.7988649878146665,9.213730921650633,6185,COMPLETE
99,0.20210149884223938,2026-05-08 08:02:54.955326,2026-05-08 08:13:33.291476,0 days 00:10:38.336150,mean,False,4,0.33628083574824646,402,6,0.11461605518236422,0.30642967381939007,0.0030983892856896343,269,5,6.7257678982511875,0.7881275273241943,9.456467937673219,6185,COMPLETE
